{
  "$schema": "http://json-schema.org/draft-07/schema#",
  "title": "LLMstruct Core Schema (Simplified)",
  "description": "Simplified core schema without external references",
  "type": "object",
  "required": ["version"],
  "properties": {
    "metadata": {
      "type": "object",
      "properties": {
        "project_name": {"type": "string"},
        "description": {"type": "string"},
        "authors": {
          "type": "array",
          "items": {
            "type": "object",
            "properties": {
              "name": {"type": "string"},
              "github": {"type": "string"},
              "email": {"type": "string", "format": "email"}
            }
          }
        }
      }
    },
    "version": {"type": "string"},
    "status": {"type": "string"},
    "author": {"type": "string"},
    "date": {"type": "string"},
    "license": {"type": "string"},
    "artifact_id": {
      "type": "string",
      "pattern": "^[0-9a-f]{8}-[0-9a-f]{4}-[0-9a-f]{4}-[0-9a-f]{4}-[0-9a-f]{12}$"
    },
    "summary": {"type": "string"},
    "tags": {"type": "array", "items": {"type": "string"}},
    "modules": {"type": "array"},
    "plugins": {"type": "array"},
    "artifacts": {"type": "array"}
  }
}
