{
  "version": "0.1.0",
  "status": "Draft",
  "author": "@kpblcaoo",
  "date": "2025-05-20",
  "license": "GPL-3.0",
  "modules": [
    {
      "name": "collector",
      "path": "src/llmstruct/collector.py",
      "functions": [
        {
          "name": "parse_project",
          "signature": "parse_project(path: str) -> dict",
          "description": "Parse project code into JSON structure"
        }
      ]
    },
    {
      "name": "cli",
      "path": "src/llmstruct/cli.py",
      "functions": [
        {
          "name": "main",
          "signature": "main() -> None",
          "description": "CLI entry point"
        }
      ]
    }
  ]
}